{
  "$schema": "https://json-schema.org/draft/2020-12/schema",
  "$id": "urn:bcast:schema:package:0.1",
  "title": "BCAST Package 0.1",
  "description": "Provider-neutral consumer contract for a BCAST regulatory package.",
  "type": "object",
  "additionalProperties": false,
  "required": [
    "schema_version",
    "package_id",
    "package_version",
    "publication",
    "objects"
  ],
  "properties": {
    "schema_version": {
      "const": "bcast.package/0.1"
    },
    "package_id": {
      "type": "string",
      "pattern": "^bcastpkg:sha256:[0-9a-f]{64}$"
    },
    "package_version": {
      "type": "string",
      "minLength": 1,
      "maxLength": 128
    },
    "publication": {
      "type": "object",
      "additionalProperties": false,
      "required": [
        "publication_id",
        "family",
        "edition"
      ],
      "properties": {
        "publication_id": {
          "type": "string",
          "pattern": "^bcastpub:sha256:[0-9a-f]{64}$"
        },
        "family": {
          "type": "string",
          "minLength": 1,
          "maxLength": 256
        },
        "edition": {
          "type": "string",
          "minLength": 1,
          "maxLength": 128
        },
        "revision": {
          "type": "string",
          "minLength": 1,
          "maxLength": 128
        },
        "title": {
          "type": "string",
          "minLength": 1,
          "maxLength": 512
        },
        "issuing_body": {
          "type": "string",
          "minLength": 1,
          "maxLength": 256
        }
      }
    },
    "objects": {
      "type": "array",
      "minItems": 1,
      "items": {
        "type": "object",
        "additionalProperties": false,
        "required": [
          "object_id",
          "kind",
          "locator",
          "status",
          "assurance"
        ],
        "properties": {
          "object_id": {
            "type": "string",
            "pattern": "^bcastobj:sha256:[0-9a-f]{64}$"
          },
          "kind": {
            "enum": [
              "document",
              "chapter",
              "appendix",
              "section",
              "subsection",
              "paragraph",
              "list_item",
              "definition_entry",
              "table",
              "figure",
              "note",
              "unsupported"
            ]
          },
          "locator": {
            "type": "string",
            "minLength": 1,
            "maxLength": 512
          },
          "parent_id": {
            "type": "string",
            "pattern": "^bcastobj:sha256:[0-9a-f]{64}$"
          },
          "label": {
            "type": "string",
            "minLength": 1,
            "maxLength": 1024
          },
          "status": {
            "enum": [
              "resolved",
              "unresolved",
              "unsupported"
            ]
          },
          "assurance": {
            "enum": [
              "unreviewed",
              "reviewed",
              "verified"
            ]
          },
          "content": {
            "type": "object",
            "additionalProperties": false,
            "required": [
              "media_type",
              "text"
            ],
            "properties": {
              "media_type": {
                "const": "text/plain"
              },
              "text": {
                "type": "string"
              }
            }
          },
          "provenance": {
            "type": "object",
            "additionalProperties": false,
            "required": [
              "citation"
            ],
            "properties": {
              "citation": {
                "type": "string",
                "minLength": 1,
                "maxLength": 2048
              },
              "source_artifact_sha256": {
                "type": "string",
                "pattern": "^[0-9a-f]{64}$"
              }
            }
          }
        }
      }
    }
  }
}
